[
  {
    "id": 1,
    "slug": "getting-started-with-bear-sunday",
    "title": "Getting Started with BEAR.Sunday",
    "body": "Lorem ipsum dolor sit amet, consectetur adipiscing elit. Sed do eiusmod tempor incididunt ut labore et dolore magna aliqua. Ut enim ad minim veniam, quis nostrud exercitation ullamco laboris nisi ut aliquip ex ea commodo consequat. Duis aute irure dolor in reprehenderit in voluptate velit esse cillum dolore eu fugiat nulla pariatur. Excepteur sint occaecat cupidatat non proident, sunt in culpa qui officia deserunt mollit anim id est laborum.",
    "excerpt": "Lorem ipsum dolor sit amet, consectetur adipiscing elit. Sed do eiusmod tempor incididunt ut labore et dolore magna aliqua. Ut enim ad minim",
    "status": "published",
    "publishedAt": "2026-01-01T10:07:00Z",
    "authorId": 1,
    "categoryId": 1
  },
  {
    "id": 2,
    "slug": "why-ray-mediaquery-changes-how-we-write-sql",
    "title": "Why Ray.MediaQuery Changes How We Write SQL",
    "body": "Lorem ipsum dolor sit amet, consectetur adipiscing elit. Sed do eiusmod tempor incididunt ut labore et dolore magna aliqua. Ut enim ad minim veniam, quis nostrud exercitation ullamco laboris nisi ut aliquip ex ea commodo consequat. Duis aute irure dolor in reprehenderit in voluptate velit esse cillum dolore eu fugiat nulla pariatur. Excepteur sint occaecat cupidatat non proident, sunt in culpa qui officia deserunt mollit anim id est laborum.",
    "excerpt": "Lorem ipsum dolor sit amet, consectetur adipiscing elit. Sed do eiusmod tempor incididunt ut labore et dolore magna aliqua. Ut enim ad minim",
    "status": "published",
    "publishedAt": "2026-02-02T11:14:00Z",
    "authorId": 2,
    "categoryId": 2
  },
  {
    "id": 3,
    "slug": "a-deep-dive-into-alps-profiles",
    "title": "A Deep Dive into ALPS Profiles",
    "body": "この記事ではBEAR.Sundayを用いた参照実装CMSを紹介します。BDRパターンにより読み込み側と書き込み側を分離し、保守しやすいコードベースを目指します。\n\n読み込み側はRay.MediaQueryでSQLを外出しし、書き込み側はRay.InputQueryで入力をオブジェクト化します。",
    "excerpt": "この記事ではBEAR.Sundayを用いた参照実装CMSを紹介します。BDRパターンにより読み込み側と書き込み側を分離し、保守しやすいコードベースを目指します。",
    "status": "published",
    "publishedAt": "2026-03-03T12:21:00Z",
    "authorId": 3,
    "categoryId": 3
  },
  {
    "id": 4,
    "slug": "hal-json-in-practice",
    "title": "HAL+JSON in Practice",
    "body": "Lorem ipsum dolor sit amet, consectetur adipiscing elit. Sed do eiusmod tempor incididunt ut labore et dolore magna aliqua. Ut enim ad minim veniam, quis nostrud exercitation ullamco laboris nisi ut aliquip ex ea commodo consequat. Duis aute irure dolor in reprehenderit in voluptate velit esse cillum dolore eu fugiat nulla pariatur. Excepteur sint occaecat cupidatat non proident, sunt in culpa qui officia deserunt mollit anim id est laborum.",
    "excerpt": "Lorem ipsum dolor sit amet, consectetur adipiscing elit. Sed do eiusmod tempor incididunt ut labore et dolore magna aliqua. Ut enim ad minim",
    "status": "published",
    "publishedAt": "2026-04-04T13:28:00Z",
    "authorId": 4,
    "categoryId": 4
  },
  {
    "id": 5,
    "slug": "bdr-pattern-explained",
    "title": "BDR Pattern Explained",
    "body": "In this article we walk through a concrete example: how we modeled a minimal CMS using BEAR.Sunday, and how the BDR pattern shaped the read side. We also discuss the write side and how it fits in.\n\nWe start by reviewing the ALPS profile, then we derive JSON Schema from observed data, and finally we generate stubs for the Query interfaces.",
    "excerpt": "In this article we walk through a concrete example: how we modeled a minimal CMS using BEAR.Sunday, and how the BDR pattern shaped the read ",
    "status": "published",
    "publishedAt": "2026-05-05T14:35:00Z",
    "authorId": 5,
    "categoryId": 5
  },
  {
    "id": 6,
    "slug": "migrating-from-phinx-to-doctrine-migrations",
    "title": "Migrating from Phinx to Doctrine Migrations",
    "body": "この記事ではBEAR.Sundayを用いた参照実装CMSを紹介します。BDRパターンにより読み込み側と書き込み側を分離し、保守しやすいコードベースを目指します。\n\n読み込み側はRay.MediaQueryでSQLを外出しし、書き込み側はRay.InputQueryで入力をオブジェクト化します。",
    "excerpt": "この記事ではBEAR.Sundayを用いた参照実装CMSを紹介します。BDRパターンにより読み込み側と書き込み側を分離し、保守しやすいコードベースを目指します。",
    "status": "draft",
    "publishedAt": null,
    "authorId": 6,
    "categoryId": 6
  },
  {
    "id": 7,
    "slug": "testing-bear-resources-without-a-database",
    "title": "Testing BEAR Resources without a Database",
    "body": "TL;DR included at the top.",
    "excerpt": "TL;DR included at the top.",
    "status": "published",
    "publishedAt": "2026-07-07T16:49:00Z",
    "authorId": 7,
    "categoryId": 7
  },
  {
    "id": 8,
    "slug": "the-hidden-power-of-php-attributes",
    "title": "The Hidden Power of PHP Attributes",
    "body": "When you treat your data as the source of truth about constraints (rather than choosing arbitrary limits up front), surprising things happen. Some fields that you assumed were 'short strings' turn out to commonly reach 200+ characters. Others you thought would be large are almost always under 50 characters.\n\nThis is the semantic-ex method applied to practice.",
    "excerpt": "When you treat your data as the source of truth about constraints (rather than choosing arbitrary limits up front), surprising things happen",
    "status": "published",
    "publishedAt": "2026-08-08T09:56:00Z",
    "authorId": 8,
    "categoryId": 8
  },
  {
    "id": 9,
    "slug": "composing-modules-with-ray-di",
    "title": "Composing Modules with Ray.Di",
    "body": "この記事ではBEAR.Sundayを用いた参照実装CMSを紹介します。BDRパターンにより読み込み側と書き込み側を分離し、保守しやすいコードベースを目指します。\n\n読み込み側はRay.MediaQueryでSQLを外出しし、書き込み側はRay.InputQueryで入力をオブジェクト化します。",
    "excerpt": "この記事ではBEAR.Sundayを用いた参照実装CMSを紹介します。BDRパターンにより読み込み側と書き込み側を分離し、保守しやすいコードベースを目指します。",
    "status": "published",
    "publishedAt": "2026-09-09T10:03:00Z",
    "authorId": 9,
    "categoryId": 9
  },
  {
    "id": 10,
    "slug": "from-crud-to-semantic-rest",
    "title": "From CRUD to Semantic REST",
    "body": "When you treat your data as the source of truth about constraints (rather than choosing arbitrary limits up front), surprising things happen. Some fields that you assumed were 'short strings' turn out to commonly reach 200+ characters. Others you thought would be large are almost always under 50 characters.\n\nThis is the semantic-ex method applied to practice.",
    "excerpt": "When you treat your data as the source of truth about constraints (rather than choosing arbitrary limits up front), surprising things happen",
    "status": "published",
    "publishedAt": "2026-10-10T11:10:00Z",
    "authorId": 10,
    "categoryId": 10
  },
  {
    "id": 11,
    "slug": "bear-cms",
    "title": "BEAR.Cms アーキテクチャ概観",
    "body": "Lorem ipsum dolor sit amet, consectetur adipiscing elit. Sed do eiusmod tempor incididunt ut labore et dolore magna aliqua. Ut enim ad minim veniam, quis nostrud exercitation ullamco laboris nisi ut aliquip ex ea commodo consequat. Duis aute irure dolor in reprehenderit in voluptate velit esse cillum dolore eu fugiat nulla pariatur. Excepteur sint occaecat cupidatat non proident, sunt in culpa qui officia deserunt mollit anim id est laborum.",
    "excerpt": "Lorem ipsum dolor sit amet, consectetur adipiscing elit. Sed do eiusmod tempor incididunt ut labore et dolore magna aliqua. Ut enim ad minim",
    "status": "published",
    "publishedAt": "2026-11-11T12:17:00Z",
    "authorId": 11,
    "categoryId": 11
  },
  {
    "id": 12,
    "slug": "alps",
    "title": "ALPSで設計を共有する",
    "body": "この記事ではBEAR.Sundayを用いた参照実装CMSを紹介します。BDRパターンにより読み込み側と書き込み側を分離し、保守しやすいコードベースを目指します。\n\n読み込み側はRay.MediaQueryでSQLを外出しし、書き込み側はRay.InputQueryで入力をオブジェクト化します。",
    "excerpt": "この記事ではBEAR.Sundayを用いた参照実装CMSを紹介します。BDRパターンにより読み込み側と書き込み側を分離し、保守しやすいコードベースを目指します。",
    "status": "draft",
    "publishedAt": null,
    "authorId": 12,
    "categoryId": 12
  },
  {
    "id": 13,
    "slug": "fake",
    "title": "Fakeデータから制約を発見する",
    "body": "Lorem ipsum dolor sit amet, consectetur adipiscing elit. Sed do eiusmod tempor incididunt ut labore et dolore magna aliqua. Ut enim ad minim veniam, quis nostrud exercitation ullamco laboris nisi ut aliquip ex ea commodo consequat. Duis aute irure dolor in reprehenderit in voluptate velit esse cillum dolore eu fugiat nulla pariatur. Excepteur sint occaecat cupidatat non proident, sunt in culpa qui officia deserunt mollit anim id est laborum.",
    "excerpt": "Lorem ipsum dolor sit amet, consectetur adipiscing elit. Sed do eiusmod tempor incididunt ut labore et dolore magna aliqua. Ut enim ad minim",
    "status": "published",
    "publishedAt": "2026-01-13T14:31:00Z",
    "authorId": 13,
    "categoryId": 13
  },
  {
    "id": 14,
    "slug": "ray-mediaquerybdr",
    "title": "Ray.MediaQueryのBDR実装例",
    "body": "TL;DR included at the top.",
    "excerpt": "TL;DR included at the top.",
    "status": "published",
    "publishedAt": "2026-02-14T15:38:00Z",
    "authorId": 14,
    "categoryId": 14
  },
  {
    "id": 15,
    "slug": "cms",
    "title": "小さなCMSの育て方",
    "body": "短いメモ。",
    "excerpt": "短いメモ。",
    "status": "published",
    "publishedAt": "2026-03-15T16:45:00Z",
    "authorId": 15,
    "categoryId": 15
  },
  {
    "id": 16,
    "slug": "semantic-ex-method-an-introduction",
    "title": "Semantic-Ex Method: An Introduction",
    "body": "Lorem ipsum dolor sit amet, consectetur adipiscing elit. Sed do eiusmod tempor incididunt ut labore et dolore magna aliqua. Ut enim ad minim veniam, quis nostrud exercitation ullamco laboris nisi ut aliquip ex ea commodo consequat. Duis aute irure dolor in reprehenderit in voluptate velit esse cillum dolore eu fugiat nulla pariatur. Excepteur sint occaecat cupidatat non proident, sunt in culpa qui officia deserunt mollit anim id est laborum.",
    "excerpt": "Lorem ipsum dolor sit amet, consectetur adipiscing elit. Sed do eiusmod tempor incididunt ut labore et dolore magna aliqua. Ut enim ad minim",
    "status": "published",
    "publishedAt": "2026-04-16T09:52:00Z",
    "authorId": 16,